severity,area,issue_type,count,first_date,last_date,example,recommended_action
medium,coverage,months_without_ranked_captures,66,2007-04,2025-12,"2007-04, 2007-05, 2007-06, 2007-07, 2007-08, 2007-09, 2007-10, 2007-12","Fetch additional CDX captures for ranked/listing pages, prioritizing long empty stretches."
high,metrics,catalog_games_without_metrics_history,1279,,,Alexia Crow and the pandora's box,Sweep metrics.json histories by catalog chunks using --catalog-offset/--catalog-limit.
high,metrics,catalog_games_need_page_history,2311,,,Kingdom Rush,Continue per-game metrics history backfill.
low,dedupe,duplicate_ranked_rows,3437,,,,Review duplicate key handling by date/source/rank/game.
medium,identity,games_with_multiple_url_variants,349,,,"www.kongregate.com/games/ioji/warbears: ['http://kongregate.com/games/ioji/warbears', 'http://www.kongregate.com/games/ioji/warbears']",Use canonical URL keys for joins and charting; consider canonicalizing processed rows.
low,plays,stale_listing_play_count_observations,132,2026-05-21,2026-01-08,Frantic,"Kept as raw observations, but excluded from true decrease counts because the value repeats an older listing count."
