severity,area,issue_type,count,first_date,last_date,example,recommended_action
high,coverage,ranked_capture_lag,71,2026-04-19,2026-06-29,latest ranked row,Run modern ranked-page discovery/fetch for the newest Wayback captures.
medium,coverage,months_without_ranked_captures,142,2007-04,2026-06,"2007-04, 2007-05, 2007-06, 2007-07, 2007-08, 2007-09, 2007-10, 2007-12","Fetch additional CDX captures for ranked/listing pages, prioritizing long empty stretches."
high,metrics,catalog_games_without_metrics_history,615,,,Crusaders of the Lost Idols,Sweep metrics.json histories by catalog chunks using --catalog-offset/--catalog-limit.
high,metrics,catalog_games_need_page_history,321,,,Learn to Fly 2,Continue per-game metrics history backfill.
high,chart,final_top_chart_entries_stale_over_one_year,9,,,Dawn of the Dragons,Prioritize metrics histories for stale high-play games still dominating final chart ranks.
low,dedupe,duplicate_ranked_rows,116,,,,Review duplicate key handling by date/source/rank/game.
medium,identity,games_with_multiple_url_variants,110,,,"www.kongregate.com/games/ioji/warbears: ['http://kongregate.com/games/ioji/warbears', 'http://www.kongregate.com/games/ioji/warbears']",Use canonical URL keys for joins and charting; consider canonicalizing processed rows.
